{"$defs":{"action":{"additionalProperties":false,"properties":{"action":{"minLength":1,"type":"string"},"evidence_refs":{"items":{"minLength":1,"type":"string"},"type":"array","uniqueItems":true},"intent_id":{"minLength":1,"type":"string"},"reason":{"minLength":1,"type":"string"},"target":{"type":"string"}},"required":["action","reason","intent_id","evidence_refs"],"type":"object"},"edge":{"additionalProperties":false,"properties":{"edge_id":{"minLength":1,"type":"string"},"evidence_refs":{"items":{"minLength":1,"type":"string"},"type":"array","uniqueItems":true},"from":{"minLength":1,"type":"string"},"reason":{"type":"string"},"relation":{"minLength":1,"type":"string"},"to":{"minLength":1,"type":"string"}},"required":["edge_id","from","to","relation","evidence_refs"],"type":"object"},"graph":{"additionalProperties":false,"properties":{"edges":{"items":{"$ref":"#/$defs/edge"},"type":"array"},"graph_id":{"minLength":1,"type":"string"},"graph_type":{"enum":["idea","intent","policy","memory","risk","identity","capability","temporal","fact"]},"nodes":{"items":{"$ref":"#/$defs/node"},"minItems":1,"type":"array"}},"required":["graph_id","graph_type","nodes","edges"],"type":"object"},"link":{"additionalProperties":false,"properties":{"evidence_refs":{"items":{"minLength":1,"type":"string"},"type":"array","uniqueItems":true},"from_graph":{"enum":["idea","intent","policy","memory","risk","identity","capability","temporal","fact"]},"from_node_id":{"minLength":1,"type":"string"},"link_id":{"minLength":1,"type":"string"},"rule":{"minLength":1,"type":"string"},"status":{"enum":["ALIGNED","MISMATCH","UNKNOWN","NOT_APPLICABLE"]},"to_graph":{"enum":["idea","intent","policy","memory","risk","identity","capability","temporal","fact"]},"to_node_id":{"minLength":1,"type":"string"}},"required":["link_id","from_graph","from_node_id","to_graph","to_node_id","rule","status","evidence_refs"],"type":"object"},"mismatch":{"additionalProperties":false,"properties":{"code":{"minLength":1,"type":"string"},"node_refs":{"items":{"minLength":1,"type":"string"},"type":"array","uniqueItems":true},"reason":{"minLength":1,"type":"string"},"severity":{"enum":["info","warning","high","critical"]},"status":{"enum":["open","contained","recovered","not_observed"]}},"required":["code","severity","status","reason","node_refs"],"type":"object"},"node":{"additionalProperties":false,"properties":{"attributes":{"type":"object"},"evidence_refs":{"items":{"minLength":1,"type":"string"},"type":"array","uniqueItems":true},"kind":{"minLength":1,"type":"string"},"label":{"minLength":1,"type":"string"},"node_id":{"minLength":1,"type":"string"}},"required":["node_id","kind","label","evidence_refs","attributes"],"type":"object"}},"$id":"https://proofpath.example/schemas/personal-agent-safety-v1.2-bundle.schema.json","$schema":"https://json-schema.org/draft/2020-12/schema","additionalProperties":false,"properties":{"capability_evaluation":{"additionalProperties":false,"properties":{"action":{"minLength":1,"type":"string"},"authority_effect":{"const":"none"},"capability_id":{"minLength":1,"type":"string"},"evidence_refs":{"items":{"minLength":1,"type":"string"},"minItems":1,"type":"array","uniqueItems":true},"identity_bound":{"type":"boolean"},"scope_status":{"enum":["IN_SCOPE","OUT_OF_SCOPE","UNKNOWN"]},"state":{"enum":["ENABLED","DISABLED","REVOKED","UNKNOWN"]},"target":{"minLength":1,"type":"string"}},"required":["capability_id","action","target","state","scope_status","identity_bound","authority_effect","evidence_refs"],"type":"object"},"capability_graph":{"allOf":[{"$ref":"#/$defs/graph"},{"properties":{"graph_type":{"const":"capability"}}}]},"containment":{"items":{"$ref":"#/$defs/action"},"type":"array"},"decision":{"additionalProperties":false,"properties":{"reason":{"minLength":1,"type":"string"},"side_effect_allowed":{"type":"boolean"},"status":{"enum":["ACCEPT","HOLD","BLOCK","UNKNOWN","DIVERGED","VERIFIED"]}},"required":["status","reason","side_effect_allowed"],"type":"object"},"evidence_manifest":{"additionalProperties":{"pattern":"^[0-9a-f]{64}$","type":"string"},"type":"object"},"fact_graph":{"allOf":[{"$ref":"#/$defs/graph"},{"properties":{"graph_type":{"const":"fact"}}}]},"idea_graph":{"allOf":[{"$ref":"#/$defs/graph"},{"properties":{"graph_type":{"const":"idea"}}}]},"identity_evaluation":{"additionalProperties":false,"properties":{"actor_id":{"minLength":1,"type":"string"},"assurance_level":{"enum":["low","moderate","high","hardware","unknown"]},"binding_status":{"enum":["VERIFIED","MISMATCH","UNKNOWN"]},"delegation_status":{"enum":["DIRECT","VERIFIED","MISMATCH","UNKNOWN"]},"evidence_refs":{"items":{"minLength":1,"type":"string"},"minItems":1,"type":"array","uniqueItems":true},"executor_id":{"minLength":1,"type":"string"},"principal_id":{"minLength":1,"type":"string"}},"required":["principal_id","actor_id","executor_id","binding_status","assurance_level","evidence_refs"],"type":"object"},"identity_graph":{"allOf":[{"$ref":"#/$defs/graph"},{"properties":{"graph_type":{"const":"identity"}}}]},"intent_graph":{"allOf":[{"$ref":"#/$defs/graph"},{"properties":{"graph_type":{"const":"intent"}}}]},"links":{"items":{"$ref":"#/$defs/link"},"minItems":1,"type":"array"},"memory_graph":{"allOf":[{"$ref":"#/$defs/graph"},{"properties":{"graph_type":{"const":"memory"}}}]},"memory_use":{"additionalProperties":false,"properties":{"authority_effect":{"const":"none"},"excluded":{"items":{"minLength":1,"type":"string"},"type":"array","uniqueItems":true},"included":{"items":{"minLength":1,"type":"string"},"type":"array","uniqueItems":true}},"required":["included","excluded","authority_effect"],"type":"object"},"mismatches":{"items":{"$ref":"#/$defs/mismatch"},"type":"array"},"policy_evaluation":{"additionalProperties":false,"properties":{"effect":{"enum":["ALLOW","DENY","CONSTRAIN","REQUIRE_APPROVAL","UNKNOWN"]},"evaluated_at":{"format":"date-time","type":"string"},"policy_id":{"minLength":1,"type":"string"},"reason":{"minLength":1,"type":"string"},"revision":{"minLength":1,"type":"string"}},"required":["policy_id","revision","effect","reason","evaluated_at"],"type":"object"},"policy_graph":{"allOf":[{"$ref":"#/$defs/graph"},{"properties":{"graph_type":{"const":"policy"}}}]},"profile":{"const":"org.proofpath.personal-agent-safety"},"recovery":{"items":{"$ref":"#/$defs/action"},"type":"array"},"risk_assessment":{"additionalProperties":false,"properties":{"evaluated_at":{"format":"date-time","type":"string"},"mitigations":{"items":{"minLength":1,"type":"string"},"type":"array","uniqueItems":true},"residual_tier":{"enum":["low","moderate","high","critical","unknown"]}},"required":["residual_tier","mitigations","evaluated_at"],"type":"object"},"risk_graph":{"allOf":[{"$ref":"#/$defs/graph"},{"properties":{"graph_type":{"const":"risk"}}}]},"temporal_evaluation":{"additionalProperties":false,"properties":{"checked_windows":{"items":{"minLength":1,"type":"string"},"minItems":1,"type":"array","uniqueItems":true},"clock_source":{"minLength":1,"type":"string"},"dispatch_deadline":{"format":"date-time","type":"string"},"evaluated_at":{"format":"date-time","type":"string"},"evidence_refs":{"items":{"minLength":1,"type":"string"},"minItems":1,"type":"array","uniqueItems":true},"max_skew_seconds":{"minimum":0,"type":"integer"},"state":{"enum":["VALID","EXPIRED","NOT_YET_VALID","UNKNOWN"]}},"required":["evaluated_at","state","clock_source","max_skew_seconds","checked_windows","evidence_refs"],"type":"object"},"temporal_graph":{"allOf":[{"$ref":"#/$defs/graph"},{"properties":{"graph_type":{"const":"temporal"}}}]},"trace_id":{"minLength":1,"type":"string"},"verification":{"additionalProperties":false,"properties":{"checks":{"items":{"minLength":1,"type":"string"},"type":"array","uniqueItems":true},"evidence_refs":{"items":{"minLength":1,"type":"string"},"type":"array","uniqueItems":true},"status":{"enum":["pending","failed","verified"]}},"required":["status","checks","evidence_refs"],"type":"object"},"version":{"const":"1.2.0"}},"required":["profile","version","trace_id","idea_graph","intent_graph","policy_graph","memory_graph","risk_graph","identity_graph","capability_graph","temporal_graph","fact_graph","links","mismatches","memory_use","policy_evaluation","risk_assessment","identity_evaluation","capability_evaluation","temporal_evaluation","decision","verification"],"title":"ProofPath Personal Agent Safety Bundle v1.2","type":"object"}
